{"contractVersion":1,"targetPackage":"gemstone-py-native","rustCore":"gemstone-rs","releaseTag":"native-v0.1.3","status":"TestPyPI and PyPI trusted publishing plus install verification passed","targets":[{"index":"TestPyPI","package":"gemstone-py-native","version":"0.1.3","workflow":"Native Wheels","runId":26107302361,"runUrl":"https://github.com/unicompute/gemstone-py/actions/runs/26107302361","createdAt":"2026-05-19T15:28:08Z","verifiedAt":"2026-05-19T15:33:26Z","conclusion":"success","installCommand":"python -m pip install --index-url https://test.pypi.org/simple/ --extra-index-url https://pypi.org/simple/ gemstone-py-native==0.1.3","verification":"native import, rust_core_implementation == gemstone-rs, RustCoreSession, and TestPyPI files/metadata"},{"index":"PyPI","package":"gemstone-py-native","version":"0.1.3","workflow":"Native Wheels","runId":26107639278,"runUrl":"https://github.com/unicompute/gemstone-py/actions/runs/26107639278","createdAt":"2026-05-19T15:33:48Z","verifiedAt":"2026-05-19T15:37:22Z","conclusion":"success","installCommand":"python -m pip install gemstone-py-native==0.1.3","verification":"native import, rust_core_implementation == gemstone-rs, RustCoreSession, and PyPI files/metadata"}]}
